{
  "schema": "orchestra.runtime-manifest.v1",
  "runtime": "core",
  "version": "1.1.1",
  "sourceRoots": [
    "core",
    "schemas"
  ],
  "managedAssets": [
    {
      "type": "tree",
      "source": "core",
      "output": "core"
    },
    {
      "type": "tree",
      "source": "schemas",
      "output": "core/schemas"
    }
  ],
  "preservedProjectPaths": [
    ".orchestra/state"
  ],
  "generatedInputs": [
    "core",
    "schemas"
  ],
  "entrypoints": [],
  "healthChecks": [
    "schema-freshness",
    "runtime-core-freshness"
  ]
}
